{
  "brief_id": "brief_metallic-identity-01",
  "cautions": [
    "Offline stub: no sources consulted; nothing here may be cited as research."
  ],
  "context_notes": [
    {
      "note": "No research was performed. These notes are fixed placeholders derived from keyword matching on the brief.",
      "topic": "offline mode"
    }
  ],
  "interpretation": {
    "open_questions": [
      "Should the human figure be visible, partial, or only implied?"
    ],
    "summary": "Offline keyword interpretation of the brief: engineered permanence; facelessness; identity as surface; industrial endurance; industrial perfection; industrial space; instability and flux; reflection and self-recognition; the body as material.",
    "tensions": [
      {
        "description": "Default tension of the metallic editorial domain.",
        "pole_a": "human identity",
        "pole_b": "material surface"
      }
    ],
    "themes": [
      "engineered permanence",
      "facelessness",
      "identity as surface",
      "industrial endurance",
      "industrial perfection",
      "industrial space",
      "instability and flux",
      "reflection and self-recognition",
      "the body as material"
    ]
  },
  "produced_by": {
    "kind": "offline_stub",
    "name": "offline-stub"
  },
  "research_id": "research_mock-demo",
  "research_mode": "offline_stub",
  "schema_version": "atelier.research_notes.v1",
  "sources": [],
  "visual_vocabulary": [
    "liquid chrome",
    "brushed steel",
    "hard directional light",
    "industrial space"
  ]
}
